{
  "interfaceVersion": "weft-application-lineage/0.2-candidate",
  "modules": [
    {
      "documentJson": "{\"id\":\"domain\",\"modules\":[{\"elements\":[{\"extensions\":{},\"id\":\"Staff\",\"keys\":[{\"fields\":[{\"element\":\"staffId\",\"module\":\"m\"}],\"id\":\"pk\",\"name\":\"Key\"}],\"kind\":\"record\",\"members\":[{\"element\":\"staffId\",\"module\":\"m\"}],\"name\":\"Staff\"},{\"cardinality\":\"one\",\"extensions\":{},\"id\":\"staffId\",\"kind\":\"field\",\"name\":\"staffId\",\"nullability\":\"required\",\"scalarType\":\"string\"},{\"extensions\":{},\"id\":\"Project\",\"keys\":[{\"fields\":[{\"element\":\"projectId\",\"module\":\"m\"}],\"id\":\"pk\",\"name\":\"Key\"}],\"kind\":\"record\",\"members\":[{\"element\":\"projectId\",\"module\":\"m\"}],\"name\":\"Project\"},{\"cardinality\":\"one\",\"extensions\":{},\"id\":\"projectId\",\"kind\":\"field\",\"name\":\"projectId\",\"nullability\":\"required\",\"scalarType\":\"string\"},{\"extensions\":{},\"id\":\"Resource\",\"keys\":[{\"fields\":[{\"element\":\"resourceId\",\"module\":\"m\"}],\"id\":\"pk\",\"name\":\"Key\"}],\"kind\":\"record\",\"members\":[{\"element\":\"resourceId\",\"module\":\"m\"},{\"element\":\"salary\",\"module\":\"m\"},{\"element\":\"token\",\"module\":\"m\"}],\"name\":\"Resource\"},{\"cardinality\":\"one\",\"extensions\":{},\"id\":\"resourceId\",\"kind\":\"field\",\"name\":\"resourceId\",\"nullability\":\"required\",\"scalarType\":\"string\"},{\"cardinality\":\"one\",\"extensions\":{},\"facets\":{\"integerWidth\":{\"bits\":64,\"signed\":true}},\"id\":\"salary\",\"kind\":\"field\",\"name\":\"salary\",\"nullability\":\"required\",\"scalarType\":\"integer\"},{\"extensions\":{},\"id\":\"Ownership\",\"keys\":[{\"fields\":[{\"element\":\"ownerId\",\"module\":\"m\"}],\"id\":\"pk\",\"name\":\"Key\"}],\"kind\":\"record\",\"members\":[{\"element\":\"ownerId\",\"module\":\"m\"},{\"element\":\"ownerResource\",\"module\":\"m\"},{\"element\":\"ownerProject\",\"module\":\"m\"}],\"name\":\"Ownership\"},{\"cardinality\":\"one\",\"extensions\":{},\"id\":\"ownerId\",\"kind\":\"field\",\"name\":\"ownerId\",\"nullability\":\"required\",\"scalarType\":\"string\"},{\"cardinality\":\"one\",\"extensions\":{},\"id\":\"ownerResource\",\"kind\":\"field\",\"name\":\"ownerResource\",\"nullability\":\"required\",\"scalarType\":\"string\"},{\"cardinality\":\"one\",\"extensions\":{},\"id\":\"ownerProject\",\"kind\":\"field\",\"name\":\"ownerProject\",\"nullability\":\"required\",\"scalarType\":\"string\"},{\"extensions\":{},\"id\":\"Assignment\",\"keys\":[{\"fields\":[{\"element\":\"assignmentId\",\"module\":\"m\"}],\"id\":\"pk\",\"name\":\"Key\"}],\"kind\":\"record\",\"members\":[{\"element\":\"assignmentId\",\"module\":\"m\"},{\"element\":\"assignmentStaff\",\"module\":\"m\"},{\"element\":\"assignmentProject\",\"module\":\"m\"},{\"element\":\"active\",\"module\":\"m\"}],\"name\":\"Assignment\"},{\"cardinality\":\"one\",\"extensions\":{},\"id\":\"assignmentId\",\"kind\":\"field\",\"name\":\"assignmentId\",\"nullability\":\"required\",\"scalarType\":\"string\"},{\"cardinality\":\"one\",\"extensions\":{},\"id\":\"assignmentStaff\",\"kind\":\"field\",\"name\":\"assignmentStaff\",\"nullability\":\"required\",\"scalarType\":\"string\"},{\"cardinality\":\"one\",\"extensions\":{},\"id\":\"assignmentProject\",\"kind\":\"field\",\"name\":\"assignmentProject\",\"nullability\":\"required\",\"scalarType\":\"string\"},{\"cardinality\":\"one\",\"extensions\":{},\"id\":\"active\",\"kind\":\"field\",\"name\":\"active\",\"nullability\":\"required\",\"scalarType\":\"boolean\"},{\"cardinality\":\"one\",\"extensions\":{},\"facets\":{\"integerWidth\":{\"bits\":64,\"signed\":true}},\"id\":\"clear\",\"kind\":\"field\",\"name\":\"clear\",\"nullability\":\"required\",\"scalarType\":\"integer\"},{\"cardinality\":\"one\",\"extensions\":{},\"id\":\"token\",\"kind\":\"field\",\"name\":\"token\",\"nullability\":\"required\",\"scalarType\":\"string\"}],\"id\":\"m\",\"namespace\":\"\"}],\"title\":\"Current UMF 0.10 lineage fixture preserving original query meanings\",\"umf\":\"0.10.0\",\"vocabularies\":{}}",
      "pin": {
        "documentId": "domain",
        "revision": "current010-lineage-r1",
        "umfVersion": "0.10.0",
        "sha256": "28c36dfd3df39f2e0e653fb2cfffa8c8bdd405be42f04cc9073e866ddae8513c"
      },
      "selectedModuleIds": [
        "m"
      ]
    }
  ],
  "sql": "SELECT COUNT(DISTINCT s.token) FROM Resource r JOIN Resource s ON r.token=s.token WHERE FALSE AND r.token='opaque-token' LIMIT 0",
  "parameters": {},
  "opaqueSources": [
    {
      "role": "policy",
      "identity": {
        "documentId": "project-access",
        "revision": "named-query-policy-r1"
      },
      "mediaType": "application/json",
      "utf8": "{\"vocabulary\":\"umf.security\",\"version\":\"0.2.0\",\"id\":\"project-access\",\"revision\":\"named-query-policy-r1\",\"ontology\":{\"documentId\":\"domain\",\"revision\":\"named-query-ontology-r1\"},\"rules\":[{\"id\":\"reader\",\"effect\":\"permit\",\"actions\":[\"read\"],\"target\":[{\"documentId\":\"domain\",\"moduleId\":\"m\",\"elementId\":\"Resource\"}],\"condition\":{\"op\":\"literal\",\"value\":true},\"disclosure\":[{\"field\":{\"documentId\":\"domain\",\"moduleId\":\"m\",\"elementId\":\"salary\"},\"disposition\":{\"kind\":\"original\"}}]},{\"id\":\"membership\",\"effect\":\"require\",\"actions\":[\"read\"],\"target\":[{\"documentId\":\"domain\",\"moduleId\":\"m\",\"elementId\":\"Resource\"}],\"condition\":{\"op\":\"exists\",\"association\":{\"documentId\":\"domain\",\"moduleId\":\"m\",\"elementId\":\"Ownership\"},\"as\":\"o\",\"where\":{\"op\":\"and\",\"args\":[{\"op\":\"eq\",\"left\":{\"kind\":\"variable\",\"name\":\"o\",\"endpoint\":\"resource\"},\"right\":{\"kind\":\"resource\",\"identity\":true}},{\"op\":\"exists\",\"association\":{\"documentId\":\"domain\",\"moduleId\":\"m\",\"elementId\":\"Assignment\"},\"as\":\"a\",\"where\":{\"op\":\"and\",\"args\":[{\"op\":\"eq\",\"left\":{\"kind\":\"variable\",\"name\":\"a\",\"endpoint\":\"staff\"},\"right\":{\"kind\":\"subject\",\"identity\":true}},{\"op\":\"eq\",\"left\":{\"kind\":\"variable\",\"name\":\"a\",\"endpoint\":\"project\"},\"right\":{\"kind\":\"variable\",\"name\":\"o\",\"endpoint\":\"project\"}},{\"op\":\"eq\",\"left\":{\"kind\":\"variable\",\"name\":\"a\",\"field\":{\"documentId\":\"domain\",\"moduleId\":\"m\",\"elementId\":\"active\"}},\"right\":{\"kind\":\"constant\",\"field\":{\"documentId\":\"domain\",\"moduleId\":\"m\",\"elementId\":\"active\"},\"value\":{\"boolean\":true}}}]}}]}}},{\"id\":\"writer\",\"effect\":\"permit\",\"actions\":[\"create\",\"update\",\"delete\",\"write-fields\",\"change-owner\",\"change-policy\",\"blind-fields\"],\"target\":[{\"documentId\":\"domain\",\"moduleId\":\"m\",\"elementId\":\"Staff\"},{\"documentId\":\"domain\",\"moduleId\":\"m\",\"elementId\":\"Project\"},{\"documentId\":\"domain\",\"moduleId\":\"m\",\"elementId\":\"Resource\"},{\"documentId\":\"domain\",\"moduleId\":\"m\",\"elementId\":\"Ownership\"},{\"documentId\":\"domain\",\"moduleId\":\"m\",\"elementId\":\"Assignment\"}],\"condition\":{\"op\":\"literal\",\"value\":true}},{\"id\":\"write-membership\",\"effect\":\"require\",\"actions\":[\"create\",\"update\",\"delete\",\"write-fields\",\"change-owner\",\"change-policy\",\"blind-fields\"],\"target\":[{\"documentId\":\"domain\",\"moduleId\":\"m\",\"elementId\":\"Resource\"}],\"condition\":{\"op\":\"exists\",\"association\":{\"documentId\":\"domain\",\"moduleId\":\"m\",\"elementId\":\"Ownership\"},\"as\":\"o\",\"where\":{\"op\":\"and\",\"args\":[{\"op\":\"eq\",\"left\":{\"kind\":\"variable\",\"name\":\"o\",\"endpoint\":\"resource\"},\"right\":{\"kind\":\"resource\",\"identity\":true}},{\"op\":\"exists\",\"association\":{\"documentId\":\"domain\",\"moduleId\":\"m\",\"elementId\":\"Assignment\"},\"as\":\"a\",\"where\":{\"op\":\"and\",\"args\":[{\"op\":\"eq\",\"left\":{\"kind\":\"variable\",\"name\":\"a\",\"endpoint\":\"staff\"},\"right\":{\"kind\":\"subject\",\"identity\":true}},{\"op\":\"eq\",\"left\":{\"kind\":\"variable\",\"name\":\"a\",\"endpoint\":\"project\"},\"right\":{\"kind\":\"variable\",\"name\":\"o\",\"endpoint\":\"project\"}},{\"op\":\"eq\",\"left\":{\"kind\":\"variable\",\"name\":\"a\",\"field\":{\"documentId\":\"domain\",\"moduleId\":\"m\",\"elementId\":\"active\"}},\"right\":{\"kind\":\"constant\",\"field\":{\"documentId\":\"domain\",\"moduleId\":\"m\",\"elementId\":\"active\"},\"value\":{\"boolean\":true}}}]}}]}}}],\"protection\":{\"id\":\"stored\",\"revision\":\"named-query-catalog-r1\"}}",
      "sha256": "0de26cfc3b409e90d69c4bd43e42829fb522bd360633afc56d7b2181e37ca897"
    },
    {
      "role": "catalog",
      "identity": {
        "documentId": "stored",
        "revision": "named-query-catalog-r1"
      },
      "mediaType": "application/json",
      "utf8": "{\"vocabulary\":\"umf.security.protection\",\"version\":\"0.1.0\",\"id\":\"stored\",\"revision\":\"named-query-catalog-r1\",\"transforms\":[{\"id\":\"vault\",\"version\":\"1\",\"kind\":\"tokenize\",\"inputDomain\":{\"documentId\":\"domain\",\"moduleId\":\"m\",\"elementId\":\"clear\"},\"outputDomain\":{\"documentId\":\"domain\",\"moduleId\":\"m\",\"elementId\":\"token\"},\"determinism\":\"keyed-deterministic\",\"reversibility\":\"vault\",\"reverseAction\":\"reverse\",\"disclosureProfile\":[\"equality\"],\"queryUse\":{\"join\":\"disclosed\",\"group\":\"disclosed\",\"order\":\"disclosed\",\"predicate\":\"disclosed\",\"aggregate\":\"disclosed\"},\"parameters\":[],\"custody\":{\"owner\":\"host\",\"vaultRef\":\"vault\",\"vaultWriteAction\":\"vault-write\",\"formatPreserving\":false,\"storageEffect\":\"stored-transformed\",\"propagation\":{\"history\":\"declared\",\"snapshots\":\"declared\",\"exports\":\"declared\",\"feeds\":\"declared\",\"caches\":\"declared\"}}}]}",
      "sha256": "e2e4e4a8110658b1aadddc38b79d13f52830e7473b703b021d2901555a707188"
    },
    {
      "role": "ontology",
      "identity": {
        "documentId": "domain",